{
  "sessionId": "0e9d8c7b-6a5f-4e3d-8c2b-1a0f9e8d7c6b",
  "cpInstance": "cp-2",
  "protocolVersion": 1,
  "serverTime": "2026-10-16T06:00:04.002Z",
  "opsEffective": [
    "txn.search",
    "txn.get",
    "txn.batchGet",
    "txn.related",
    "filing.extract",
    "export.stream",
    "ledger.health"
  ],
  "maxInflight": 16,
  "heartbeatIntervalMs": 20000,
  "idleTimeoutMs": 60000,
  "currentConfigVersion": 14,
  "currentBundleVersion": 37
}
